Title,Description,Link,Official Link,Image,Deadline,Eligibility,Host Country,Host University,Program Duration,Degree Offered,Region,Post_at
Duke University Karsh International Scholarship 2025/26 in USA (Full Scholarship),"Scholarships in USADuke University Karsh International Scholarship 2025/26 in USA (Full Scholarship)ByMuhammad Saim Rasheed-May 17, 2025",https://opportunitiescorners.com/duke-university-karsh-international-scholarship/,https://ousf.duke.edu/merit-scholarships/karsh-international-scholars-program/,,Deadline: 1st November 2025,,United States of America,Duke University,3-4 years,,USA,"May 17, 2025"
Harvard University Boustany MBA Scholarship 2025/26 in USA,"Scholarships in USAHarvard University Boustany MBA Scholarship 2025/26 in USAByMuhammad Saim Rasheed-April 12, 2025",https://opportunitiescorners.com/harvard-university-boustany-mba-scholarship/,https://boustany-foundation.org/scholarship-programmes/mba-harvard/,,Deadline: 31st May 2025,"The Scholarship is open to all Nationals.Candidates must possess an excellent academic background.While the Scholarship is open to candidates ofall nationalities, preference will be given to those of Lebanese descent.Applicants are only eligible to apply for the Scholarship after receiving an official offer of admission to the Harvard MBA program.
Also Check:ARICE Scholarship 2025/26 in Romania (Fully Funded BS, MS, PhD)",USA,Harvard University Boustany MBA Scholarship,1-2 years,MBA,USA,"April 12, 2025"
USEFP Fulbright Scholarship 2026 in United States (Fully Funded),"Scholarships in USAUSEFP Fulbright Scholarship 2026 in United States (Fully Funded)ByMuhammad Saim Rasheed-December 1, 2024",https://opportunitiescorners.com/fulbright-scholarship/,https://www.usefp.org/scholarships/fulbright-degree.cfm,,Deadline: 5th March 2025,"To apply for the USEFP Fulbright Scholarship 2026, you must meet the following requirements.
For the Master’s degree Program:
All applicants must have a four-year Bachelor’s degree or a Bachelor’s and Master’s, if combine them it will make a total of 16 years of formal education.Must be educated from an accredited University.Recent graduates are strongly encouraged to apply.The MBA students can apply but they should have at least 2 years of work experience.
For the PhD degree Program:",United States of America,Must be educated from an accredited University,18 years,"Masters, PhD",USA,"December 1, 2024"
University of Miami Stamps Scholarship 2025 (Fully Funded) USA,"Scholarships in USAUniversity of Miami Stamps Scholarship 2025 (Fully Funded) USAByOpportunities Corners-October 21, 2024",https://opportunitiescorners.com/university-of-miami-stamps-scholarship-in-usa/,https://admissions.miami.edu/undergraduate/financial-aid/scholarships/stamps/index.html,,Deadline:1st November (every year),,USA,University of Miami Stamps Scholarship,3-4 years,Bachelor,USA,"October 21, 2024"
"List of Scholarships in the USA For 2025 (BS, MS, PhD Scholarships)","Scholarships in USAList of Scholarships in the USA For 2025 (BS, MS, PhD Scholarships)ByMuhammad Saim Rasheed-September 13, 2024",https://opportunitiescorners.com/list-of-scholarships-in-usa/,https://opportunitiescorners.com/how-to-apply-to-us-universities/,,Deadline:1st December,,,Hennessy Scholarship at Stanford University,3-4 years,Masters Program,USA,"September 13, 2024"
How to Apply to US Universities (Step by Step Guide),"Scholarships in USAHow to Apply to US Universities (Step by Step Guide)ByMuhammad Saim Rasheed-August 27, 2024",https://opportunitiescorners.com/how-to-apply-to-us-universities/,https://www.calstate.edu/apply,,Deadline not specified,,, how to select a College or university,1-2 years,,USA,"August 27, 2024"
University of Hawaii ADB Scholarship 2025 in USA (Fully Funded),"Scholarships in USAUniversity of Hawaii ADB Scholarship 2025 in USA (Fully Funded)ByMuhammad Saim Rasheed-August 20, 2024",https://opportunitiescorners.com/university-of-hawaii-adb-scholarship/,https://www.eastwestcenter.org/apply/asian-development-bank-japan-scholarship-program,,Deadline: 1st December 2024,"The following programs are eligible for the master’s degree programs that are funded by the ADB-JSP at the University of Hawaii at Manoa and East-West Center:
Business Administration (Global MBA): TOEFL or IELTS (EWC and UHM); GMAT (UHM only)Economics (MA): TOEFL, DUOLINGO, or IELTS (EWC and UHM); GRE (UHM only)Geography (MA): TOEFL, DUOLINGO, or IELTS (EWC and UHM); GRE (UHM only)Natural Resources and Environmental Management (MS): TOEFL,DUOLINGO, or IELTS (EWC and UHM); GRE (UHM only)Ocean and Resources Engineering (MS): TOEFL, DUOLINGO, or IELTS (EWC and UHM); GRE (UHM only)Oceanography (MS): TOEFL, DUOLINGO, or IELTS (EWC and UHM); GRE (UHM only)Pacific Islands Studies (MA): TOEFL, DUOLINGO, or IELTS (EWC and UHM)Public Administration (MPA): TOEFL, DUOLINGO, or IELTS (EWC and UHM)Sociology (MA): TOEFL, DUOLINGO, or IELTS (EWC and UHM); GRE (UHM only)Tropical Plant and Soil Sciences (MS): TOEFL, DUOLINGO, or IELTS (EWC and UHM); GRE (UHM only)Urban and Regional Planning (MURP): TOEFL, DUOLINGO, or IELTS (EWC and UHM)
Also Check:KYOTO University ADB Scholarship in Japan (Fully Funded)",USA,University of Hawaii ADB Scholarship,3-4 years,Fully Funded scholarship,USA,"August 20, 2024"
USEFP Fulbright Scholar Program 2025 in USA (Fully Funded),"Scholarships in USAUSEFP Fulbright Scholar Program 2025 in USA (Fully Funded)ByMuhammad Saim Rasheed-August 18, 2024",https://opportunitiescorners.com/usefp-fulbright-scholar-program/,https://www.usefp.org/scholarships/fulbright-scholar.cfm#faq,https://i0.wp.com/opportunitiescorners.com/wp-content/uploads/2024/08/FulbrightScholarFlyer2025-scaled.jpg,Deadline: 18th September 2024,"Open to scholars, professionals, and artists from all disciplines except clinical medicine.An applicant must hold a Ph.D. or a terminal degree in his/her fieldExcellent command of written and spoken English.A clear and well-formulated proposal outlining U.S. objectives and their relevance to work in Pakistan.For lectureship applicants: Demonstrated teaching experience in a university setting.
Also Check:Youth Interfaith Leaders Fellowship, USA (Fully Funded)",USA, college or university,3-4 years,EWC Graduate Degree Fellowship in USA (Fully Funded),USA,"August 18, 2024"
"KFC Scholarship 2024-25 Apply Online, Application Form, Requirements","Scholarships in USAKFC Scholarship 2024-25 Apply Online, Application Form, RequirementsByMuhammad Saim Rasheed-August 16, 2024",https://opportunitiescorners.com/kfc-scholarship/,https://kfcfoundation.org/scholarships/,,Deadline:Application deadline is in February.,"Applicants must be employees of a participating KFC restaurant in the United States. Both part-time and full-time employees are eligible.Employees must have been employed by KFC for a minimum of 90 days at the time of application.The scholarship is available to both high school seniors and current college students who are pursuing a post-secondary education.Employees must work an average of 15 hours per week.Applicants must be enrolled in an accredited two-year or four-year college, university, or vocational/technical school.A minimum GPA of 2.5 on a 4.0 scale is generally required.Applicants must be at least 16 years old.
Also Check:The Amazon Future Engineer Scholarship Requirements, Eligibility, Deadline",U.S.A, I completed my higher education from University,2 to 4 years,EWC Graduate Degree Fellowship in USA (Fully Funded),USA,"August 16, 2024"
"Yale University Scholarship 2024-25, Application Form, Requirements, Deadline","Scholarships in USAYale University Scholarship 2024-25, Application Form, Requirements, DeadlineByMuhammad Saim Rasheed-August 15, 2024",https://opportunitiescorners.com/yale-university-scholarship/,https://finaid.yale.edu/costs-affordability/types-aid/scholarships-and-grants,,"Deadline: 15 December, 2024","Yale seeks students who have demonstrated exceptional academic performance throughout their high school careers. A strong GPA, high standardized test scores (SAT/ACT), and rigorous coursework are essential.Yale is committed to need-based financial aid, meaning scholarships are awarded based on the financial need of the student.Beyond academics, Yale values leadership qualities and active participation in extracurricular activities.Scholarships are open to U.S. citizens, permanent residents, and international students alike. There is no distinction in the financial aid process based on citizenship.Best online courses
Also Check:EWC Graduate Degree Fellowship in USA (Fully Funded)",U.S.A,"Yale University Scholarship 2024-25, Application",2 to 5 years,EWC Graduate Degree Fellowship in USA (Fully Funded),USA,"August 15, 2024"
"The Amazon Future Engineer Scholarship 2024-25 Requirements, Eligibility, Deadline","Scholarships in USAThe Amazon Future Engineer Scholarship 2024-25 Requirements, Eligibility, DeadlineByMuhammad Saim Rasheed-August 9, 2024",https://opportunitiescorners.com/the-amazon-future-engineer-scholarship/,,,"Deadline:31stDecember, 2024","Applicants must be high school seniors planning to enroll in a full-time undergraduate program in computer science, software engineering, computer engineering, or other related fields of study.Applicants must plan to attend an accredited four-year college or university in the United States.Demonstration of significant financial need is required. This is typically assessed through the Free Application for Federal Student Aid (FAFSA).A minimum cumulative grade point average (GPA) of 2.3 on a 4.0 scale (or equivalent) is required.Applicants must be U.S. citizens or permanent residents.",U.S.A,year college or university,4 years,Master of Arts,USA,"August 9, 2024"
EWC Graduate Degree Fellowship 2025 in USA (Study in USA),"Scholarships in USAEWC Graduate Degree Fellowship 2025 in USA (Study in USA)ByMuhammad Saim Rasheed-August 9, 2024",https://opportunitiescorners.com/ewc-graduate-degree-fellowship/,http://www.eastwestcenter.org/applygdf,,Deadline: 1st December 2024,"Individuals who are permanent or a citizen of these countries can apply for the East-West Centre Graduate Fellowship 2024.
United StatesPacific Region:  American Samoa, Australia, Cook Islands, Federated States of Micronesia, Fiji, French Polynesia, Guam, Kiribati, Marshall Islands, Nauru, New Caledonia, New Zealand, Niue, Northern Marianas, Palau, Papua New Guinea, Samoa, Solomon Islands, Tokelau, Tonga, Tuvalu, Vanuatu, Wallis & Futuna IslandsSoutheast Asia:  Brunei, Cambodia, Indonesia, Laos, Malaysia, Myanmar, Philippines, Singapore, Thailand, Timor-Leste, VietnamSouth Asia:  Afghanistan, Bangladesh, Bhutan, India, Iran, Maldives, Nepal, Pakistan, Sri LankaEast Asia:  China, Hong Kong, Japan, Macau, Mongolia, North Korea, South Korea, Russia, Taiwan",United States, and PhD Degree scholarship at the University,3-4 years,University of Hawaii,USA,"August 9, 2024"
"American Legion Auxiliary Scholarship (Types, and Requirements)","Scholarships in USAAmerican Legion Auxiliary Scholarship (Types, and Requirements)ByMuhammad Saim Rasheed-August 4, 2024",https://opportunitiescorners.com/american-legion-auxiliary-scholarship/,,,Deadline,The eligibility criteria for each scholarship type vary. Below are the general requirements for the major scholarships:,, Asia Pacific University,1-2 years,,USA,"August 4, 2024"
"Coca-Cola Scholarship 2024-25, Requirements, Deadline, Application","Scholarships in USACoca-Cola Scholarship 2024-25, Requirements, Deadline, ApplicationByMuhammad Saim Rasheed-August 3, 2024",https://opportunitiescorners.com/coca-cola-scholarship/,,,"Deadline: 30 September, 2024","Applicants must be United States citizens.Applicants must be current high school seniors at the time of application.Applicants must have a minimum cumulative GPA of 3.0 on a 4.0 scale at the end of their junior year of high school.Applicants must be planning to pursue a degree at an accredited U.S. post-secondary institution.Applicants should demonstrate leadership qualities through roles in school or community organizations, clubs, or sports teams.Current employees of Coca-Cola, its subsidiaries, or bottlers, as well as children or grandchildren of current employees, are not eligible to apply.Best online courses
Also Check:The Gates Scholarship Program 2025 in USA (Fully Funded)",USA, I completed my higher education from University,4 years,,USA,"August 3, 2024"
Boston University Trustee Scholarship 2025 in USA (Study in USA),"Scholarships in USABoston University Trustee Scholarship 2025 in USA (Study in USA)ByMuhammad Saim Rasheed-August 3, 2024",https://opportunitiescorners.com/boston-university-trustee-scholarship/,https://www.bu.edu/admissions/tuition-aid/scholarships-financial-aid/first-year-merit/trustee/,,Deadline: 1st December 2024,The Boston Univeristy Trustee scholarship is for students who want to pursue an Undergraduate degree program.,,Boston University Trustee Scholarship 2025,3-4 years,by December 1,USA,"August 3, 2024"
AU Emerging Global Leader Scholarship 2025 in the USA,"Scholarships in USAAU Emerging Global Leader Scholarship 2025 in the USAByMuhammad Saim Rasheed-July 26, 2024",https://opportunitiescorners.com/au-emerging-global-leader-scholarship-usa/,https://www.american.edu/admissions/international/au-egls-apply.cfm,,"Deadline: December 1, 2024","The scholarship is open to all other nationals except US Nationals.Students who are still enrolled in a secondary or high school and they expecting to graduate by June 2025.Open to students from diverse and underrepresented global and socioeconomic backgrounds.A minimum 3.8 GPA equivalent out of 4.0 GPA (or in the top 10% of graduating class) for 9th-12th grades.Students must also haveONEof the following Proof:TOEFL iBT: Overall score of 95 with a minimum of 20 in each section.Paper-based TOEFL: Overall score of 24 or higher (taken after May 31, 2017).IELTS: Overall band score of 7.0 with a minimum of 6.0 in each band.SAT: Minimum score of 33 in the Reading section or a score of 630 or higher in the Evidence-Based Reading and Writing section (digital version, as of March 2023).ACT: Minimum score of 29 in English.PTE: Minimum score of 65.Duolingo English Test: Minimum overall score of 125 with a minimum of 115 in each section.Cambridge Assessment English: Overall score of 185 with a minimum of 169 in each component.IB Diploma:Students must complete the full IB Diploma program, including at least three Higher Level (HL) subjects.British A-Levels:Students must achieve a minimum of three A-level qualifications and have completed thirteen years of formal education by August 2025.Must be able to get an F1 or J1 Study visa.
Also Check:
US J1-VISAUS F1 Study Visa",USA,"American University, Washington D.C.",3-4 years,Students interested in all majors offered at AU are eligible to apply. Check thelist of degree programs for Bachelors students.,USA,"July 26, 2024"
The Gates Scholarship Program 2025 in USA (Fully Funded),"Scholarships in USAThe Gates Scholarship Program 2025 in USA (Fully Funded)ByMuhammad Saim Rasheed-July 18, 2024",https://opportunitiescorners.com/the-gates-scholarship-program/,https://www.thegatesscholarship.org/scholarship,,Deadline: 15th September 2024,,USA, or public college or university,3-4 years,Undergraduate,USA,"July 18, 2024"
Knight Hennessy Scholarship 2025 in USA (Fully Funded),"Scholarships in USAKnight Hennessy Scholarship 2025 in USA (Fully Funded)ByMuhammad Saim Rasheed-June 1, 2024",https://opportunitiescorners.com/knight-hennessy-scholarship-2025/,https://knight-hennessy.stanford.edu/admission/before-you-apply/eligibility,,Two Deadlines:Scholarship Deadline: 9th October 2024Admission Deadline at Stanford University: Varies by program,"Anyone from any country can apply for the Knight Hennessy Scholarship.The applicant must be enrolled and accepted in a full-time Stanford graduate degree program. The list of all Stanfordgraduate programs.Meet the graduate program requirements.The applicant must have earned a bachelor’s degree in January 2018 or later.Provide English Language Proof.There is no minimum requirement for your grades or scores.There is no application fee for Knight-Hennessy Scholars, but you must pay any application fees required by yourgraduate programwhen you submit that application.",USA,Stanford University,3-4 years,"JD, MA, MBA, MD, MFA, MS, DMA, and PhD",USA,"June 1, 2024"
